name,price,asin,seller,categoria,rank,valoracion_media,busqueda,marketplace
Hanes Maglietta da Uomo Cool DRI Tagless_Maroon_L,"50,87 €",B01D1UYZQK,,,,,Maglietta,amazon.fr
Nu'jeans E'na Maglietta [Import Anglais],,B0082REM16,,,,"3,6",Maglietta,amazon.fr
Bread & Tulips (Import - NTSC All Regions) by Lucia Maglietta,,B01EGQOXDS,,,,"4,5",Maglietta,amazon.fr
Maglietta sana T-Shirts Pokémon parodique Yoda et Sacha Ketchum,,B07MNNMNQ5,,,,,Maglietta,amazon.fr
DIESEL Umtee-randalthreepack Maillot de Corps (Lot de 3) Homme,"29,99 € - 61,90 €",B07CP6VYQD,,Vêtements,47209,"4,3",Maglietta,amazon.fr
